{
  "$schema": "../schema/game-manifest.schema.json",
  "id": "orbital-slingshot",
  "version": "0.1.0",
  "sdk": "0.1.0",
  "status": "prototype",
  "title": "Orbital Slingshot",
  "summary": "Plot gravitational slingshots through collapsing star systems. Harness orbital velocity to collect telemetry and dock with extraction gates.",
  "engine": { "name": "Canvas2D", "version": "1.0.0", "rendering": "2d-adaptive" },
  "entry": "/src/games/orbital-slingshot/OrbitalSlingshotGate.tsx",
  "presentation": { "orientation": "landscape", "aspectRatio": "16:9", "accent": "#00f0a8" },
  "input": ["keyboard", "touch", "gamepad"],
  "sessions": { "minimumSeconds": 30, "targetSeconds": 120, "maximumSeconds": 180 },
  "assets": { "initialBytes": 32768, "totalBytes": 65536 },
  "scores": { "mode": "higher-is-better", "ruleset": "trajectory-v1", "validation": "local-deterministic-route" },
  "achievements": [
    { "id": "first-insertion", "title": "Orbital Insertion", "target": 1 },
    { "id": "slingshot-master-x6", "title": "Lagrange Master", "target": 6 },
    { "id": "full-survey", "title": "Quadrant Surveyor", "target": 4 }
  ],
  "save": { "schemaVersion": 1, "maximumBytes": 65536 }
}
