{
  "$schema": "../schema/game-manifest.schema.json",
  "id": "orbital-pinball",
  "version": "0.1.0",
  "sdk": "0.1.0",
  "status": "prototype",
  "title": "Orbital Pinball",
  "summary": "Frameless sci-fi pinball suspended in open space. Keep a relay field alive through precision flipper play, node banks, orbital loops, and escalating score chains.",
  "engine": { "name": "Babylon.js", "version": "9.20.0", "rendering": "webgl-adaptive" },
  "entry": "/src/games/orbital-pinball/OrbitalPinballGate.tsx",
  "presentation": { "orientation": "landscape", "aspectRatio": "16:9", "accent": "#20d9ef" },
  "input": ["keyboard", "touch", "gamepad"],
  "sessions": { "minimumSeconds": 20, "targetSeconds": 180, "maximumSeconds": 180 },
  "assets": { "initialBytes": 1048576, "totalBytes": 8388608 },
  "scores": { "mode": "higher-is-better", "ruleset": "orbital-pinball-v1", "validation": "local-session" },
  "achievements": [
    { "id": "first-array", "title": "Relay Online", "target": 1 },
    { "id": "chain-eight", "title": "Resonant Orbit", "target": 8 },
    { "id": "high-orbit-five", "title": "High Orbit", "target": 5 }
  ],
  "save": { "schemaVersion": 1, "maximumBytes": 65536 }
}
